content,satisfaction_label
use amazon wait two day ship dont support oligarchi trash jeff bezo hard,0
someth went wrong end messag keep get annoy tiem take day ship even pay monthli fee temu seem like better option point hurri get item,0
alway great experi,2
love amazon everyth need,2
great fun need credit,2
great place shop wish would show product made usa,2
new app realli suck feedback option either,0
new layout make harder view previou order add way mani categori layout chang,1
quick ship,1
lead time terribl,1
dosnt ship libya ship libya im go tell frendi buy amazon,2
forget,0
amazon make order easi love conveni,2
amazon great find anyth need ship right door,2
get realli tire place order money taken account week later put entir order hold cancel tire order item told card declin suffici fund call find amazon doesnt item done amazon,2
app trash,1
turn deal recommend push notif annoy intrus otherwis app work well order view order deliveri statu,2
qualiti experi,1
poor deliveri poor product extrem poor commun account put digit due faulti item return refund miss deliveri due incompet deliveri driver compani joke say least im surpris peopl even bother still use,0
fraudul seller work incorpor amazon scam item take time refund lesson buy anyth platform also fill complaint bank,0
imag product commentsreview never load full screen,1
perform mangelt es der app gewaltig,1
wow that great,2
multibilliondollar compani app hideou slow purpos made make cancel andor refund purchas difficult obviou intent design make issu resolv hard possibl entir imposs make option hard find scatter app andor buri beneath option click search click downright malevol tactic utterli reprehens fix app,0
add addit step get order list etc total unnecessari dont fix isnt broken,0
couldnt easier could,0
uninstal,1
number one applic,2
mess interfac use,0
awesom hi,1
someth rece tkt happen dark mode amazon bright white cant brows night light led suv burn retina,2
like good idea,2
feel good shop,2
typic use amazon quit time dont realli leav review never reason product good bad custom servic outsourc work bunch oversea agent dont care money give run around good compani past anyway bought product sketchi seller sketchi list say wait hour seller respond care,0
technic issu cant solv order get cancel app custom servic couldnt solv issu mani call solut,0
keep switch currenc dollar,1
amazon degrad updat anyth think plan close perman start use temu replac work better cheaper good qualiti product fraction price amazon cancel prime well,2
verif redund led verifi payment method multipl time,1
get easier hard reach live repres,2
pleas add option chang black theme black mode,1
ɪᴍ ᴀ ᴄᴏʟʟᴇᴄᴛᴏʀ ᴀɴᴅ ᴀ ᴘᴀɪɴᴛᴇʀ ᴛʜᴇʏ ʜᴀᴠᴇ ɢʀᴇᴀᴛ ɪᴛᴇᴍ ᴀɴᴅ ᴛʜᴇ ᴘʀɪᴍᴇ ғʀᴇᴇ sʜɪᴘᴘɪɴɢ ᴀɴᴅ sᴇʀᴠɪᴄᴇ ɪs ɢʀᴇᴀᴛ ᴛᴏᴏ ʙᴜᴛ ᴛʜᴇɪʀ ᴘʀɪᴄᴇ ʜᴀᴠᴇ ʀᴇᴀʟʟʏ sᴋʏ ʀᴏᴄᴋᴇᴛᴇᴅ ʙɪɢ ᴘɪɴᴋʏ ʀᴇʙᴏʀɴ ᴅᴏʟʟ ᴀʀᴇ ɴᴏᴡ ᴀᴛ ᴛᴏ ᴡᴀʏ ᴏᴠᴇʀᴘʀɪᴄᴇᴅ ɴᴏᴡ ɪ ᴘᴀʏ ᴏɴ ᴛᴇᴍᴜ ᴍʏ sᴛᴀᴛᴜᴇ ɪ ᴡᴀ ʙᴜʏɪɴɢ ᴀʟsᴏ ʜᴀᴠᴇ ᴅᴏᴜʙʟᴇᴅ ɪɴ ᴘʀɪᴄᴇ sᴏʀʀʏ ᴀᴍᴀᴢᴏɴ ʙᴜᴛ ɪ ᴊᴜsᴛ ᴄᴀɴᴛ ᴀғғᴏʀᴅ ᴛʜᴇsᴇ ᴘʀɪᴄᴇ ғᴏʀ ᴍʏ ʀᴇʙᴏʀɴ ᴍᴀᴋᴇᴏᴠᴇʀ ᴀɴᴅ sᴛᴀᴛᴜᴇ ᴘᴀɪɴᴛɪɴɢ ʙᴜsɪɴᴇsss ɪғ ᴛʜᴇ ᴘʀɪᴄᴇ ɢᴏ ᴅᴏᴡɴ ɪʟʟ ᴄᴏᴍᴇ ʙᴀᴄᴋ,1
amazon tri ship horribl track make usp look amaz,2
updat app forc peopl look money make featur one want corpor manipul beyond pathet point look like anoth ceo go cut run soon dirti work sharehold get old,2
love amazon get anyth need get super fast,2
colour match icon,1
bad experi app far better amazon deliveri issueswait medic devic suppos day ago still didnt receiv order,1
driver stole packag amazon noth,2
hassl free shop great app,2
οk,1
cant cancel amazon prime due app show button need cancel subscript,2
new updat take longer get thing need dont like updat pleas switch back see order quickli new quick link useless peopl buy stuff want see order order stuff better suggest would allow us edit quick link,1
wont let use rainbow load sight top,2
besid fact imposs find anyth your look due everi singl product descript contain everi singl buzz word dictionari find lowest qualiti possibl dozen differ knock off actual find respect brand name one recogn often cheaper buy brand directli final straw howev card verif wont accept payment verifi card im done buy,0
learn use app properli overwhelm cant find singl use button get,0
great custom servic get problem resolv promptli,2
love iti use app year,2
enough,1
commento app e servizio insiem servizio se spendi piú di non paghi la spedizion teoria si pratica ti mandani gli oggetti acquistati pacchi diversi e ti fanno pagar la spedizion lo stesso sa dinganno applicazion limmagin di cani che appar ogni volta che non hai connession ti condiziona ad associar lanimal momenti di brutta notizia e frustrazion fino quando non finisci per detestar il cane,1
serious consid cancel account delet app late servic gotten realli bad get notif say packag deliv arent happen time alreadi last month,0
wonder everytim,1
ill stick ebay custom servic terribl wait day refund order amazon mess smh pathet,0
delet,1
amazon app visual way noisi permissionwis way intrus common use,2
like shop amazon realli forc sign prime time like,2
hate march th app redesign far less use click requir want bad updat,0
use amazon time issu whenev someth come mail come good condit time time except late past two order delay transit one delay week keep ask want refund dont think get item still big deal chose prime could get hous faster,2
amazon biggest shop app make app work month still cant look border unless go websit app doesnt work pixel pro xl say sorri error page tri thing tri see order show touch stay noth,0
app got wors last updat extra step get exist order track,1
compromis account,1
pretti much everyth could need want drive store fight crowd,0
love shop amazon truli everyth need fingertip super easi shop save much time alway know im go get qualiti product deliv super speed give yall gold star servic thank much bless day,2
slowwww,1
rufu annoy pleas stop ad ai assist block product dont need advic opinion everyth research make way turn that easi find want ai advic ill ask alexa,0
stop chang menu layout extra click get order never good chang,0
brows histori pick choos show us show us actual brows histori like use leav app momentarili everi time return take us homepag show us item amazon wish show instead return item left walmart app return place left also dark mode would nice choic set,2
amazon pleas stop use ai provid help without give us list self help answer help fix problem prime account chang annual expens monthli cost,2
point pay amazon prime still wait week receiv someth deliv today cancel prime today,0
thing three differ time everi time magic day order there delay transit would take week deliv absolut garbag,0
say devic could authent go everi amazon link take straight app work,2
im love,2
frequent chang app make difficult use app chang view order modifi cancel order view subscript etc provid inform user assist cours support,0
enter account made account never use want use say account lock,0
broken app cant place order amazon account loss great awhil love amazon prime video,2
amazon great,2
never use amazon scam artist tri scam amazon amazon awar scam noth done could would remov icon past look work amazon brought attent scam artist,2
love amazon prime member problem wait coupl day deliveri even though dont prime usual receiv deliveri within hour window issu stuff order expect amazon issu full refund second return item scan up store love love amazon,2
shop amazon make everyth easi everyth need deliveri key,2
im assum mobil app program particularli intellig chimpanze,1
older version better,2
chang member ship monthli yearli bring back googl play way updat cancel done amazon,2
simpl fast everyth one place,1
like old version better,2
think good idea,2
cant disabl auto play video,0
bad trail cant got zero star order app deliveri call told address right wait close line block sorri paid cost order didnt receiv order cant reach custom servic bad applic,0
dont complaint happi app one suggest pleas dark mode poor eye,0
wors version yet obvious shopper design order hidden stuff anoth pop menu search horribl preset search default instead go press prime next daythough often late day everytim search hassl amateur hour,1
terribl search algorithm app almost unus tri tri use site year pass search becom less less capabl even year ago could still use filter search item today display photo massiv one item shown screen find correct item wrong item take whole screen eyesight chang abil spell know want buy,0
dont like alreadi prime ask join app confus,1
ad extra click get order obnoxi,1
free shop app jeff bezo greedi,2
keep go back updat need log,1
unnecessari chang app got ta push button get go check order list wish ad dumb thing app one need,0
nice product,2
like thought trash,2
shop amazon exclus would swear depend recent last order place sure would deliv amazon that advertis receipt said got notif say packag go deliv usp vehement oppos recent got notif packag deliv fact never deliv happen twice,2
stop move thing around realli annoy everi month reorgan app button make scaveng hunt user,0
easi peazi,1
phish,1
pathet third class custom servic provid uae amazon couldnt even imagin misguid custom record line moreov dont procedur launch complaint poor servic,0
التطبيق وقف بعد اخر تحديث ومش عايز يشتغل,1
pessoal cuidado produto não entregu produto sem rastreio reembolso complicado uma pena estão perdendo um comprador assiduo,1
love amazon much avail food across world cloth stuff dread diy one place,2
بيجيب حاجات غير المطلوب و احيانا حاجات مش شغاله اصلا بدل المره كذا مره,1
order cancel without notif found manual check account amazon sent cancel messag call custom support reason name payment card didnt match amazon account issu amazon declin payment upfront instead charg card cancel order later make wait day refund amazon cancel tv kept warranti wall mount order activ,2
okay app wish stuff chines scam bought gerber strong arm knife got turn fake app would good wellregul,2
paid item get deliv wrong hous,0
need dark mode long option dark mode,1
shop way time l get deliveri entri point safe place,2
great easi app use,2
love amazon deal day wish amazon actual store area sold groceri thing like mayb would put big walmart busi,2
great place shop amazon prime get speedi deliveri,2
cant unsubscrib amazon music app,0
doesnt instal galaxi g,1
app doesnt work mess sinc least decemb gotten unus link dont open app crash much look phone screen say noth ident theft rise cost terribl qualiti aw custom servic inabl deliv thing time question public relat get onlin marketplac work properli,2
love amazon got everyth need,2
option item limit,1
first deliveri order diamond paint sent pictur diamond ask replac told pictur see turn cant pictur diamond use,2
origin amazon agesdelet app mistak daywent download app againand say phone compat android phone,2
purchas third parti sellersi purchas refurbish phone seller sent phone screen issu return next day amazon atoz guarante bs kept seller said phone lcd broken exactli reason sent backnot even hour kept money contest amazon back seller mention took day arriv ship white bubbl mailer without phone im pay,0
custom servic absolut fantast,1
goood,1
doesnt work phone,1
help issu consi,2
still cant uninstal app,1
good homework check option,2
cant search review cant save filter app slow,0
horribl new design pleas put thing back refresh view limit much make user live miser peopl shouldnt relearn app find thing easi locat get want peopl find new thing didnt know that go happen person want look one thing like go groceri store find everi ile store move trip min take minut smh,0
interfac chang wors,1
want easili see order take three tap see order page,2
easi shop easi return thank amazon,2
new updat terribl press line use take info noth say haul dont idea haul even want check order statu cant see list order noth horribl updat app useless bad enough order would swap know cant see anyth,0
redesign list page ridicul show list vertic horizont make difficult find account info,0
amazon ship bill address instead ship address even order clearli show ship address bunch screwup,0
amazon deliv everi time thrill custom servic ive receiv need,2
amazon isnt worth shop deliveri suck noth never deliv time packag even bring amazon anymor pass carrier everyth get mix everyon start point finger keep boycot amazon ty servic still wait bed suppos deliv rd never got even though truck deliveri never receiv next day either th still deliveri,2
lost order cant give refund order lost wish could give,0
find everyth need without drive hour tri find,1
great idea logist bafflinggo amazon well done,2
never log,1
scroll page look like fp,2
fact archiv order app huge headach preview gift pop top list what point nondescript packag worri everi time open app sit near someon someth privat shouldnt need go comput fix,2
order auto cancel keep get email say believ unauthor parti may access account email credit card email recipi would think amazon would want money,2
app obvious amaz part except subscrib save calendar let pick day want make easier align deliveri instead aw ai whatev use forc date make ss infuri use,2
could stop horribl updat use tab search guess dont actual want shop fix mess app pathet,0
filter dont work tri highlight prime button free deliveri item boom itll show video,2
alright,2
honestli dont know app made much bother go amazon websit log order need dont think that reason delet app sever day,0
complic,1
deliveri get difficult count overal great cant say synchroni,2
suport é horrível bloquearam conta minha porqu tentei comprar um kit de ferramenta e un iten tecnológico mesmo mandando fatura dígito cartão rg título de eleitor e foto do iten mesmo assim bloquearam e ainda por cima não cancelaram compra como afirmam tive que ligar para banco cancelar para eu não pagar parcelado algo que eu nem iria receb pior suport que eu já vi,1
seit knuspr implementiert wurd kommen bei filtern nach nur prime artikel auch artikel die man nur bei knuspr erhalten kann da der mindestbestellwert hier auch für prime mitglied bei liegt sind dies ergebniss irrelev und störend knuspr sich nutz ich schon lang dies erzwung pushen die prime artikel ist kontraproduktiv und ärgerlich,0
amazon gotten ignor price scooter part higher walmart ship doubl,2
fácil de usar nunca tenido un problema con esta aplicación,1
dont like new app look order subscript ise friendli,0
dont know happen amazon theyv fallen bit packag constantli delay alreadi take week deliv use take day happen amazon,0
app hep full need dont bring ad pleeeeeeeeas,1
keep close tri reinstal carri close realli annoy unus,0
search specif item without scroll page suggest sponsor result might relat hard purchas item goe stock quickli shop algorithm garbag,0
latest updat introduc fatal bug prevent use search bar type anyth press enter refresh current screen doesnt perform search henc find buy anyth amazon need get act togeth hire real develop qa team nearli everi singl updat break someth im get aw sick part unpaid beta test labour forc updat problem persist search still doesnt work ill buy walmart instead,0
like order dont like one thing photo item room cant get im tri look someth buy,2
خدمة عملاء سيئة جدا تم غلق حسابي و حاولت التواصل لفهم الامر و تصحيح الوضع ولكن بلا جدوى اتصلت اكتر من مرة وفي كل مرة يطلب منس انتظار تواصل ولا احد يتصل و الاسوء ان يتم خصم منس اشتراك البرايم دون وجه حق و دون ان يكون لي حساب مغعل من الاساس,1
excel servic easi use,2
last month order delay,0
use gift card,2
creo que el servicio en gener la atencion han decaido bastant,1
latest updat horribl want addit popup five tini bubbl tap one time hit three bar bottom answer dont doubt anybodi els either also rufu wast space make idiot ai tool option,0
prefer use web browser version instead app open tab browser quit often app open tri delet app couldnt delet,1
amazon spain madrid work amazon thank,2
keep account alway lock account dont card unlock chang card want deactiv,2
love amazon lot shop,2
deliveri late,1
horribl custom experi custom servic issu resolut seller interact month refund item never ship month refund request direct commun seller need take note ebay noth neg experi ill never use amazon,0
automat scroll past review product dont want read isnt control see past thing home page,0
open locker wast hour far custom servic courier tri get order never order amazon,0
deliveri prime longer come told still take day worth money pay prime,2
great app longer afford,2
doesnt work time time belguim open browser amazon wich inchur compani cant acc app becous instead open amazon shop app open browser amazon local adrass com,2
good aap im happi,2
work anymor cant press anyth see purchas edit profil,1
thank much,2
forc peopl go ad layer sale categori menu go check order certainli choic could make choic insur ill shop elsewher im tire heavi hand market ive alreadi rip alexa home look like cancel prime next step,2
cant find set look set see look set theyv move dont tell stupid featur delet app asap,2
love great price,2
love amazon app shop way better ebay,2
tire order held multipl order guess im move walmart hold order come late offer credit never receiv well,2
alway get order,1
still work bpost dont even bother deliv adr pick packag post offic,2
amazon allow person own account sure allow whomev connect uninstal mayb amazon wake smell rose,2
amazon custom year uae saudi howev decid leav platform due poor deliveri servic mani time recent experi surpris undeliv item show deliv way contact amazon saudi look like autom platform employe manag complaint like uae big risk unabl trace packag without deliveri pin code,1
shop nice app,2
mostli love app search engin need improv meta tag advanc search option like must includenot includ would help beyond frustrat search someth get bunch result im look exampl meal replac shake yield result powder mix ive yet find way filter,2
dark mode appar bezo doesnt care custom similar problem alexa left behind ai develop,0
edit amazon fix deliveri time almost everi link click problem forc close app amazon get control everi purchas use prime get deliv time last order got sent wrong place return seller also advis couldnt purchas item anymor custom servic could careless say never happen sorri,0
everyon know conveni,1
keep crash,0
complaint,0
bad experi laggi look review tend lag app start look imag review video pleas fix thank,0
happi app dont shop much onlin im happi app,1
didnt bring packag time,1
amazon resal complet scam theyll put cheaper item box expens item charg expens price insan,0
get uh oh someth went wrong manag get place sign keep tell check internet connect run fiber,0
ship expens item cost,1
amazon absolut worst right pay express ship order get cancel numer timesthen tell order deliveredthen tell order canceledthen tell would get refundand tell call policether absolut reason go thisand im horriblehorriblehorr never order,0
love conveni fit type budget good perk addit varieti decent qualiti product major purchas deliv within hour limit issu great return polici fairli decent custom servic,2
easier get refund ebay get refund amazon faster ebay far faster ebay up pick packag alreadi give money back day alreadi,2
terribl verif,1
item order amazon alway deliv late night neighbor order amazon deliv lunch break like state right next door dont understand,2
place order compani cancel day arriv buy higher price made angri,0
bought new tablet tri put amazon app reason app wont let sign account frustrat,2
get expens disappoint everyth even custom servic forgotten compani surviv also thank satisfi custom good custom might renew subscript next year forget app asap,1
love recent gone way temu mani ad look tacki second rate bring back classi old design,2
need dark theme option,1
never r shop wy app victim ident theft peopl make account n name pleas close r discharg stop send ad pleas,0
show mani ad much cheap junk feel like search engin get wors everi year,2
didnt ask app want app phone let delet get neg,0
absolut love site there boatload item need mani dont want anyway regardless alsoi get lot product free time gon na littl secret,2
great stuff,2
save leav hous sick,1
love conveni app vs site amazon prime deliveri date option alway accur almost worth pay prime deliveri daytim,2
trash monopoli corpor,1
prime free sinc make billion use app,2
alway look fast deliveri option need,1
conveni econom,1
order part truck isnt yet,1
dread absolut dread,0
amazon great way shop home pretti much everyth need want,2
nice app love,2
im get packag time amazon prime anyon els got amazon prime get packag time also deliveri time keep chang later later day,2
mobil app great shop tool help make decis buy product everi day,2
love amazon best onlin market ever ever want buy someth head straight amazon,2
great pricesgoodsand servic,2
dont stick promis ship time place order good chunk time day past suppos deliv mainli happen travel deliveri serviceb,2
poor deliveri driver total ignor deliveri instruct left deliveri next recycl bag ring doorbel let know deliveri day parcel class sensit hand person im afraid driver leav parcel doorstep good enough amazon word,2
everyth overpr sourc irrespons,1
work well one could expect never pocket charg cant say temu,2
rais price bunch app buggi,1
stuff realli work bad knee three knee surgeri younger year year ive tri differ supplement realli good product second time im purchas,0
play video search result onestar would like nativ amazon app ye app full compromis pointless,2
driver never deliv time custom servic doesnt care,0
okay app need someth coupl featur tick one stupid question popup window bottom screen never help give info find look item alway pop dont need hard get rid chat bot also need ton work alway get runaround tri ask help someth bot doesnt understand,0
good easi use,2
account delet tri reach custom servic custom servic work,1
absolut terrif easi conveni secur,1
fast deliveri work great,2
amazon slow ship send one thing time total rip offif could give star would amazon one big rip ive better place send item,2
cant get servic,1
order stuff alway broken wrong order,0
app tend lag like crazi ultra well previou ultra still dark mode,2
app doesnt work fail slot,2
excel app whole famili use iteasi return refund whole lot better cheap rubbish temu,2
gd marketplac,1
liter hate secur amazon much dont trust,0
there interest free payment check use affirm avail option month high interest smh,2
randomli chang locat usa ive unabl chang back,1
chang applic contact back new address form caus full form clear loosen input terribl ux result place order right integr phone googl account add materi design,2
trend add click get menu,1
buggi quit unintuit doesnt open link redirect necessari region store wish theyd redesign app,2
order stuff amazon sever year price reason get order fast thank amazon would love work wholesal warehous,2
lock account couldnt prove bank statement old card close account isnt anyway could get statement bank close account im delet app switch temu someth shitzon,1
depend servic,1
work updat,1
selfinstal properti would never want piec trash,0
amazon app bug issu account set shortcut app gone iphon app navig android differ easier whatev upgrad downgrad made app difficult navig iphon,2
next day deliveri lie ill never order amazon,0
didnt show option payment crucial,1
love shop amazon im alway amaz fast product come plu driver alway respect properti,2
recent updat march app hand worst experi app ive use everyday day made everyth intuit one button middl everyth make one tap thing use one get purchas account set far confus use still dark mode open app night im blind matter dim screen,0
dark mode pleas,1
think wonder app didnt know put main page app play store could fix would fantast great day,2
horrid rancid absolut trash tri ten ef time fix payment get help hour screw im never use amazon ruin day whole birthday week,0
amaz love,2
alway point,1
alway someth believ need ship great,2
order refurbish headphon sold ship amazon box headphon contact support refund said theyd come pick today nobodi show hassl mistak made amazon offer back ive paid headphon im certain backup headphon want wont sale time sort disappoint,2
bought ugg amazon packag care love etc also gave free fast deliveri order arriv less hour recommend amazon alot obsess app,2
dont understand cant activ prime account inform date still prime servic dont option join cant even call anyon get help,2
rea payment procedur enabl,1
idk theyr custom servic matter promis deliveri date kept move week sometim two even whole month suppos receiv packag today packag deliv pmpm pm packag might arriv th custom servic nonexist helper app useless ask want cancel order want packag promis term servic agreement invalid,2
alway use,1
reload card work great christma birthday,2
good product easi use good deal good custom servic thank amazon,2
ive order amazon never issu deliveri servic good cant complain good work,2
bad servic order week ago didnt receiv yet bad servic,0
hate app l inpati person told order come today didnt come l excit realli made day horribl,0
packag order dont come date frustrat come usp never problem beforeso disappoint,2
مقاطعة,1
look like temu new haul beta one star,2
