content,satisfaction_label
ive longtim prime user strong purchas histori recent cash deliveri cod option disabl account without explan despit contact custom support three time issu remain unresolv frustrat see poor servic platform ive trust year,2
amazon tracker doesnt work anymor,2
main menu almost unus seem full irreleventpaid suggest,1
packag said today nowher seen liar,0
great site reason offer fast ship,2
thief,0
time,1
app seem broken access account histori suggest item buy previous purchas,0
click away,1
hate amazon owe money sinc christma,0
tri shop fix incom help,2
extrem user friendli easi navig item need,1
love amazon much,2
servic bad cooper deliveri compani deliv order time order cancel money return time,0
wont open latest updat get white screen amazon box logo stay,2
great price quick deliveri,2
bad time,0
account got hack march th april th custom servic done noth help put request fix lead nowher,2
good servic thank,2
everyth ever purchas perfect arriv time top qualiti,2
everi time launch app get blank screen need kill app launch make work that annoy,0
bangladesh,1
order amazon first time happi order happi get use rest amazon gift card balanc anoth order need fix shouldnt keep order item dont want get order sign amazon prime account credit card order amazon like forc someon buy thing dont want pleas fix thank,2
alway poor qualiti come appkic describt v good,0
pleas dont use amazon pay option payment queri give option payment method work get messag axio declin payment option contact custom care,2
خدمة العملاء سيئة جدا,1
ive notic price fluctuat due interest item im go guess theyr use ai price goug tech also order seem take longer almost even worth annual cost anymor,2
sca,1
great place,2
fail sign infail reset passwordbad app,0
kia hill ha,0
best way get best qualiti product market,2
push button done easi,1
good shope,2
great price larg varieti merchandis,2
cant review item ive purchas use gift card purchas demand bank card access review purchas,2
amazon use great custom servic aw servic awe us,2
peopl mess gift card balanc,2
start get pretti tire amazon app past month anytim search anyth take long give stupid dog say uh oh difficult order late made updat tri turn wifi keep tri uninstal reinstal,0
order thing march th order get delay twice first time said would arriv april second april second come packag still carrier offic get delay april rd th request refund wait day money want wait would wait packag offer type discount delay order im glad order import better amazon,2
easi conveni,1
amazon incap perform simpl transact absolut useless cant spend money amazon wont accept id verif yet spend thousand walmart ebay pretti much everywher els complet realiti disconnect shockingthey liter sent email tell log account one lock resolv issu exist mind compani deserv bankruptci,0
justvreceiv nox catvfood billrd stainless steel cutleri,1
oversel cant deliv order deliveriesdont advertis cant deliv,1
good guess idk,2
love fast deliveri need car parti asap got next day,2
add unremov amazon search option android context menu,2
happen lot choos great pride,2
doesnt load fast everi time updat get wors,1
love superkitti toy,2
order ship week chat custom servic week chat got told time week past deliveri period call custom servic told air knew truth account debit th call custom servic guy said oh card debit let told time way custom servic window dress amazon script,2
way turn fresh whole food option never anyth stock order cake bake suppli friend bday didnt product even though let order make sens paid tip go drive store end well need filter disabl fresh whole food also shadi busi look protein powder disabl abil filter ebt even though ebt option protein powder,2
peak,1
ive never seen app similar without custom servic way contact fail ad phone number,0
least half time tri use app take error go back home page screen,0
disappoint help choic return damag item end pay wallet return someth hand broken item glass insid prime member expect better treatment temu amaz return ill lean,0
send mani notif disturb plz never see,0
tend lock phone accident drag imag mostli work well search algorithm still sucki compar feebay filter price lowtohigh instanc lose result filter origin avoid long ship time question chines seller,0
quick easi,1
cant instal iphon design old devic,1
longer good valu amazon cut plu ship charg prime hidden ship charg mean price longer competit competit caught conveni deliverycollect logist day ebay robert dya john lewi mark spencer cover use amazon,2
app use huge amount mobil data mb per month bare use minut dont understand im go uninstal use web site whenev need,2
paid dollar inch star brander came even inch,1
shop time mani year,1
updat app noth work wont let add item cart noth show,1
app malfunct realli bad imag error messag see search complet,0
think amazon got hack cant see anyth card price cant see old order,2
way greedi,1
driver need learn read soon possibl product alway great driver know read follow direct actual receiv deliveri,2
alway time il never issu deliveri anyth amazon amaz everyth,2
best exspens app,2
app amaz truli best shop app ever experienc download recommend,2
dark mode would rate higher,1
easi addict,1
excel custom servic satisfact,2
nice job,2
fantast job,1
sinc souq becom amazon egypt becam bad seller amazon constantli send wrong faulti product wrong colour size often mislead descript everi order return purchas sell sketcher use cheap brand call activ abou alaa purchas trainer believ skecher turn chines knockoff sick disgust let,0
low price good deal,2
never get amazon prime keep deley order pay expedit deliveri cool,2
amazon prime nice thank,2
review app amazon commerci use app moder enjoy cant explain much cool stuff use time app your amazon your balanc,2
suck loss custom dont want see past order show resent,0
find need amazon,2
live set packag deliv door decid deliv everi packag except two im disabl specifi packag deliv front door use amazon servic ever receiv servic paid,2
sinc cant send complaint app im give bad review instead make imposs help issu complaint yall make one big circl click charg account shouldv kept money instead ping account day purchas hit day ship nope wont chang review custom servic get wors time progress,2
never get credit rush ship balanc alway zero read mani peopl issu,0
worst shipment servic ever worst custom servic ever,0
bug move find stuff everi week amazon realli gone downhil,2
amazon infuri app order anyth like wait day take payment think paid im fact amazon hasnt taken soon spend money amazon sudden rememb order app actual take payment order dont worri pay get paid move credit card time order,2
kick account sell item dont want anyon els problem given amazon one star,0
love much got mani cute help thing,2
app remov amazon option appear menu highlight word appbrows androidoppo phone imposs control featur disgust behaviour big compani push everi corner phone,0
سيء من ناحيه انك توصل لخدمه العملاء انا جبت الرقم من جوجل غير كده مكنتش هعرف استلم الاوردر الي كان مكتوبلي أنه وصل مع أنه موصلش أما خدمه العملاء تمام غير كده من ناحيه ال feedback محدش كلمني ولا عبرني و لا اكتب كتبت حاجه,1
dont want app somehow cant delet,0
dejado comprar toda la semana,1
love product never disappoint,2
your better without prime your packag still get day prime longer mean day rare get someth quick prime video definit doesnt make worth sinc charg watch anyth even though your alreadi pay pleas stop send usp lose thing ruin thing take forev get ever get also thing keep charg ship thing say free,0
cancel order day expect even though pre order month ago,0
doesnt work,1
good app theyr freez account bc suspici activ suspici activ trynna order bed couch apart,2
ask turn nfc verifi physic card im,0
unabl log,1
fals advertis theyll get pay prime advertis day ship order updat standard ship,0
made purchas im charg immedi becom return refund need week time shop elsewher,1
app broken basic featur miss like app unabl take screenshot featur android,0
ever happen day deliveri packag never show due amazon logist problem get togeth amazon current packag mile away day thing happen previou order week ago,0
packag cant seem get carrier facil cant seem deliv pm late packag seem treat like regular earli whatev happen qualiti control busi sell product arent complet damag seem amazon help last purchas didnt piec pathet ridicul even happen,2
modifi hide use function order track three level two level one level requir one work even get past ad also version notabl slower especi retriev order statu chang acceler shift buy walmart shift continu,0
took payment time take money without verif someon stole card buy anyth amazon almost imposs find commun way money back,2
theyv basic got everyth alreadi version product your look howev bill process need work,1
satisfactori,1
سياسة امازون في استرجاع المنتج حتي لو الخطأ من عندهم زي الزفت,1
sever respiratori ill amazon help recoveri alway deliv fast everyth need,2
go digit onlin shop platform,1
dark mode android kid,1
use work fine realli annoy glitch kick back scroll everi your read review incred annoy,0
video work order first time ever see goe ill back work far appear good give better review reciev stuff great condit star get attent fix video plan five star review,2
great app user friendli wish app dark mode set,2
dont want struggl custom servic aw thu dont even think buy valuabl stuff give one star receiv small notebook bought,0
للأسف كل يوم يتكتب على السيستم خرج للتوصيل ومش بيوصل وخدمة العملاء مش بتحل خدمة العملاء سيئه جداااااا,1
app good user friendli outdat design countri like spain lag point want use store constantli close reopen app,2
thing cheap,1
artifici delay dispatch custom prime exampl let order sit day dispatch hour deliveri shame,0
glitchi,1
forc phone cant uninstal,1
new rufu ai updat forc app chang order histori gone well done amazon,2
cant instal app new phone samsung galaxi ultra,1
use good fill chines front fake review scam peopl az guarante use mean someth say might take week process request might well order temu stuff cheaper actual deliv faster,0
best ever happen,2
dont know happen amazon perfectli fine randomli got sign account sign mom busi account go log email say account hasnt creat email order least worth stuff arriv week stuff suppos come today never dont fix gon na big issu,0
like app deliv date never accur pay prime membership seem pointless order alway run late delay due weather even say sameday deliveri qualiti item order call custom servic worst say need wait next day receiv item dont receiv call back cancel item order frustrat,0
great drain much batteri even open,2
ive never disappoint except dress suppos cotton polyest,2
dont like jump three hoop get money back someth wasnt deliv,0
abl use late app updat stop work tri redownload still work sorri worth look amazon safari,2
live senior live facil door close pm deliveri driver alway courteou effici polit thank driver amazon,2
amazon sweden failur allow scam third parti seller take advantag custom turn socal bs az claim protect declin claim return postag cost send back item germani protect custom pocket kr thiev,2
im get deliveri late,1
app use much data,1
work good except im unabl easili view past purchas week old,2
previou updat app take long time load move page page,1
amazon everyth,2
checkout shown import fee checkout page add addit import fee also hard find way switch region,0
great experi everi time,2
alway order amazon give best servic free deliveri need issu messag request refund send item back that rare would nice could tri new product trial item buy often,2
app shadi put random stuff save later cart tri check remov item put back get new discount price ive amazon year realli shadi stuff dont realli trust think may get rid amazon video suck clutter stop use amazon music problem dont know fix think theyr greedi,0
love app wish would stop chang way app look term button push find order go subscrib save button move around peopl may big deal peopl find navig around app difficult wish would stop,2
shouldnt difficult access order shop app one frequent use featureswhi buri two three menu deep clear easili access icon home screen take directli order histori priorit usabl,2
amazon suck nowaday ship slow noth show go around good,2
think latest updat broke thing tab bottom discontinu reinstal app said previou order obviou option dark theme,0
still reciev remot control,1
love order amazon absolut hate wait packag ship take payment websit ive order last order product three product arriv day four book order go take week get gotten use app much anymor wait week wild book ill pay coupl extra dollar go walmart,0
absolut zero reason abl cancel membership prime subscript video app instead forc websit amazon harm monopoli take advantag user also cant use app vpn effect clearli priorit data collect anyth els logic make sens especi work fine pc addit help desk ridicul annoy unhelp,0
aint oneyet,1
im log show recent order ive made least order past month say order show last month onlin websit fine app actual blow,2
tri order tini thing got noth troubl never uninstal,1
alway quick respond return made easi,1
تطبيق ممتاز,1
realli wish would add filter made usa could easili shop thing made america,2
love cant get enough,2
yet use,1
sometim valu money,1
absolut horribl order first packag app somehow packag got deliv km away luckili someon found im never order,1
deliveri pakistan,1
hate amazon take long take money bank ughh,0
good product select includ book kindl digit media ton item consid food item select ship well item sometim nonreturn annual membership,2
fine none three item order arriv got money back longer conveni buy time pass,2
custom servic custom servic richer compani poorer servic,2
go home page amazon list price item expect price go actual item list use clickbait suddenli say oh way isnt price offer fals advertis wast ing time hardcor offens last order arriv perman close amazon account guess like lose busi walmart app easier use,2
start scam,0
impress deliveri usa australia day,2
good stuff,2
use websit app routin deni cancel websit problem accept second later,0
amazon app great unlik app iphon use portrait mode app samsung tablet also allow shop use landscap mode love featur,2
dont pay prime peopl dont accommod dont tell issu order either dont care alway alway alway check bank acct good lie process refund use mf caution,2
amazon brought back option sort review date thank amazon,2
everyon,1
tri hard know order blackpink lightstick googl found amazon work,2
order tablet deliveri driver nick reg kn kvh tri fight stole packag video dont recommend buy amazon start steal money,0
order packag didnt get im call sinc day get packag money back tell everytim wait hour amazon franc stupid im goanna sue,0
new updat make app complet unus,1
unbeliev servic,1
best shop platform world,2
excel job thank,2
work great one thing drive absolut crazi swipe delet save later section confirm normal make major purchas year thing need come year one time spend anywher time ive spent month research fine turn cart work state year easier swipe scroll accident delet someth infuri,2
ver absolut horrid navig quick access button bottom app amazon chang someth work year great worth everi updat may year kept chang ui wors better last updat put amazon logo center access sub menu access menu hamburg menu nite gone easier fact step confus navig help pl chg back far better what,2
amazon alway problem ad stuff list ive discov see someth like dont want miss add favourit list late keep get error messag ad item list resort use amazon websit instead app,0
custom year alway satisfi purchas issu resolv day highli recommend amazon im disabl senior vet made easier get gift famili product,2
great everyth keep great work thank fast custom respons support servic,2
think get nerv dont mean,1
basic temu disguis day absolut aw app find anyth worthwhil,1
would love chang countri shop put deliveri postcod would save set let search item rather instantli revert back counti want order thing amazoncouk get deliv uk shouldnt complic extrem frustrat,2
cant believ dark mode avail pleas add dark mode,1
far good amazoncojp use amazon time excel far,2
tri call help line chang mind,2
profession servic includ custom care highli recommend,2
great auto topup doesnt seem work mo pleas fix,2
go add dark mode,1
unsubscrib uninstal due us tariff,1
happen product review filter there also option sort recent,1
ping back amd forth buy choos payment method joke,2
slow boot,1
zero custom servic way speak someon help,2
adchiv order found app updat year still adchiv order found use app must use web browser what bad app wonder amazon softwar engin updat app dont want,0
charg subscript ask want refund back,2
help recent there custom servic,2
conveni shop amazon,2
recent updat app disabl filter function product review doesnt allow filter base recent review top review show predatori practic hope amazon revers,2
amazon discrimin nonprim member hog certain item gpu member offer altern nonprim member item hog part membership,2
give star due rufu ad abl disabl come screen everi time click someth matter abl hide complet cover small portion screen samsung devic may need click thing cover meer fact cant disabl option ridicul updat still hate rufu cant disabl pleas chang design back color design choic,0
everyth fast ship pay extra charg,0
like thank,2
longer see review sort recent bleah super help see product declin,2
great latest updatenow open app open display overs sectionkind face realli uncomfort look atworst product review option sort recentnow default sort helpfulwhich ok would read review year back sinc found help among other mani product chang year use,2
amazon keep suggest product alreadi back bought concept row machin recent consid buy cushion instead save later get lot recommend buy row machin includ concept recent bought turntabl recommend turntabl includ one bought ai mayb au artifici unintellig pleas fix realli annoy,2
took away option sort review make imposs filter fakepaid review vs real one better amazon,2
abl search someth without unrel cloth item show instead make frustrat difficult look someth,0
hack mom card,1
cant sort review anymor prefer sort recent review first forc see top review,2
oop someth went wrong,0
would like cancel dont get much prime,2
tri subscrib prime without get free month without googl play android somehow connect like squar danc yet amazon custom servic help unconnect googl play lol lol,2
everyth anyth fast,1
worth year subscript actual save money deliveri excel long oversea,2
rearrang layout app alarm rate usual wors time horrend cancel prime roll walmart someon actual approv wors creator one said accept nobodi want shop store get rearrang weekli dei finest,0
best program ever,2
buy tooooo much make easi spend,1
noth ever work like rufu alway auto chang address unit state,2
bad experi order starter said stock email said order would next day pm next day said delay said would pm follow day wait nothingso contact support said stock said purchas said avail said inconveni give percent morn told card declin plenti money,0
neutral,1
product qualiti servic similar alibaba price wors notif serv ad constantli chang price item cart annoy,0
extrem laggi poorli optim ton bug,1
latest updat broke bluetooth locker pickup,0
easi find need,1
excel product custom servic great product choic excel custom servic great return polici actual talk custom servic repres need,2
game best,2
new version app even open freez main white screen,1
guy keep chang three hash mark bottom app use go allow see purchas keep find hell good stop chang damn app make difficult navig,0
could would give zero download could inform there sale certain item cart well inform buy there anoth item low price reduc price item follow,2
good need combin myltipl email address password one account e could show onlin autom help wasnt avail frequent buyer onlin custom servic need avail phone go help page,2
simpl fast easi deliveri alway time care,2
dark mode yet white bright screen night realli caus eye discomfort ebay dark mode year yet amazon fail make featur possibl,0
dont like longer sort review date,0
ive fan app mani year current fan checkout method simpl way confirm payment method order submit made sever purchas cancel chang payment method recent seen there option chang payment method review order,2
look amazon im pay prime cant get item say dont ask product review,2
rate app amazon servic gener find standard onlin shop app function updat notif time order expect howev design far bright lot white space render app uncomfort use night low light condit hard understand compani resourc amazon seem incap implement effect dark mode,2
app dosent much varieti product thing ridicul price ive order mess numer time packag lost ship take forev use app want person opinion find better app,0
sux wont work phone,0
recent updat unabl use app keep get uhoh messag forc stop app clear catch instal app still work,2
perform someth pay late packag left area short cover porch constantli late,0
support dark mode april despit fact peopl use also search often return irrelev result pathet amazon,2
cant believ best amazon realli hard find anyth without scroll ton sponsor product arent relev cant search review ai question field doesnt anyth compani larg much money app pretti pathet,0
realli worth membership anymor almost everi singl item ive purchas recent arriv day late buy item temu fraction price,2
realli like amazon,2
favorit site shop,1
great experi use amazon,2
excel servic never problem order return love amazon thank amazon excel servic,2
awesom life hack,1
absolut useless app uninstal access amazon account everyth need via log regular web page phone includ especi sell someth sell app complet useless goe android paypal ebay app theyr useless ive uninstal access site phone web browser,0
cant get rid old phone number cant log,2
amazon new na amazon household name societi evolv globalloc ecommerc provid,2
greatest,2
couldnt sign amazon account new phone number old email keep go cyrcal,0
use goto app shop that case anymor search result almost never give actual look full cheap knockoff garbag ship almost alway late ive gotten damag use product care count use best place price convinc find use retail store pickup use amazon,2
lousi custom servic,1
check cricket suppli like buy noth avail,2
best shop fastest deliveri ever thank amazon,2
rufu useless,0
south africa option less,1
want buy book said free postag checkout ask postag that free also item quit pricey seller make larger profit site pay postag mislead never use,2
su place secretli exclud custom pay full price prime elig prime ship amazon went cheap,2
fake deliveri time constant struggl get item time,0
everyth ya need fingertip,1
dont want forc updat softwar,0
lv,1
great site,2
recent place first order amazon left quebec terribl experi instead attempt deliv packag simpli took back ask pick canada post deliveri attempt noticejust unnecessari hassl what point pay home deliveri go pick extrem disappoint servic amazon deliveri montreal becom unreli doubt ill order,0
awesom deal,1
pretti darn good littl confus navig non shop featur much dont suggest correct except dont make custom servic option readili access gon na doc star,2
amazon shop get rid mum pop shop put local busi busi,2
bad custom servic ban talk reason also app problem vodaphon cashegypt didnt tri fix app bug discuss custom servic mislead somehow doubl problem enough today,0
amazon alright way contact amazon call cant access live chat problem chat,2
someth wrong latest updat app isnt work show item cart noth actual,0
conveni reliabl easi use,1
noth like first becam member theyv consist deliv late wait vital car part never got last novemb middl hurrican basic strand absolut help custom support liter one offer gift card rectifi thing absolut ban compani entir,2
bei jedem start erscheint ein abofal die beim falschen wegklicken zu einem prime abo führt da muss nicht sein und entwertet dies app bitt nachbessern,0
amaz pic bad prefer better,0
حبو اوي,1
nice alway need,2
rd parti resel dont proper licens sell charg beyond retail,1
wont show order histori everyth show option never dont know bug app,1
good expier,2
love much thingz,2
function straight point app,2
hate hate new chang want button list order back dont time type search thumb way thru hundr suggest updat make think may buy much amazon use less,0
made account digit purchas reason refus say even fix ever im sure noon happi take money,2
tri find,1
ive tri delet amazon app reason made order phone got deliveri date amazon didnt show day look order gave anoth deliveri date happen time decid get anyth amazon,2
absolut enjoy amazon shop easi payment arriv time return easi fast,2
exel valu,1
new uninstal menu updat without abil revert old menu,1
work correctli often amazon one would hire,2
la peor ap solo person tubiero un si grasia,1
price good fast free deliveri,2
app came preload new devic usual use websit app websit prompt review purchas alreadi review long agoeven year ago cant clear fix pleas annoy contact custom servic worthless matter,0
good way shop onlin,2
traah work great use,2
love much anymor im still charg prime order via app tell dont amazon prime ill probabl uninstal app ridicul servic constant glitch straight thiev steal money bank report fraud,1
wait mani year write review amazon gener given full subscript forc corner make app difficult use abl click bottom right corner click order labyrinth click order hard unecessari click dont chang thing sake chang see wast click order order home screen stop wast money,0
