content,satisfaction_label
cant unsubscrib,1
veeeeeeeeeeeeerrrrryyyyi conveni got algorithm point,1
pay prime membership therefor access certain benefit advertis next day prime deliveri servic complet con time dont even receiv item item ive order arriv late also review wipe account longer abl leav product review kind ive attempt rectifi told work big compani there suspici activ account nonsens,2
simpl love,2
go back old ui shouldnt scroll see old order,1
bad wast time effort set account speak direct person place order site kept spin circleveri riski place ordersnev shop bye,0
got absolut scam amazon last week spent gift card load gift card proceed order fanci cologn amazon perman lock account suspici activ well least order get deliv right wrong cancel deliveri im scare use amazon watch happen want refund pleas,0
live easytous,1
ever sinc phone upgrad amazon app work,2
betray us latino amazon,0
uninstal ap shop amazon period updat cant unistal like viru,0
useless close account reason wont even respond email recommend,0
search result filter app certain product come websit dont exist app understand would welcom explan dev,2
type pillow use hypoallergen filter first pillow come made latex dumbest app time,0
app okay care research theyr groceri section decept receiv half product twice money lucki get piec thaw warm buyer bewar god help us housebound,2
hard get touch real person skeptic one ladi ask right away last four debit card telephon number chang forgot password allow use email address send code old number better way custom servic verifi account unprofession,2
rufu abl disabl ai stuff benefit rather custom ai need fulli option,2
dope,1
im angri item arriv there option apponli refund track fix,1
amazon awesom,2
amazon fell big time iveen custom sinc r ship deliveri isnt fast wasi made order friday suppos come saturday say come sundayit sunday one item come tomorrow anyon pay fast ship ship get delay walmart faster im customeri might dump amazon,0
amazon problem deliveri driver either lie deliveri dont bother deliv time month driver havent deliv havent attempt deliveri driver rate,1
easi shop everyth,1
wont let sign new account find new app better amazon,2
great way get want want,2
keep check interfac imposs find chang languageregion,1
block screenshot checkout screen app,0
great necess avoid crowd great servic sometim app doesnt find specif im search scroll find need suggest great new haul addit amaz,2
uninstal ethic reason,1
seem mani thing order day take long receiv,1
realli worth everyth overli expens prime doesnt even deliv like suppos wait packag prime packag week,0
unsubscrib canadian bye bye,1
everytim make new search make reelect prime button what point pay prime unselect use automat,0
order screen perman load cours redirect app tri phone browser,1
canadian bye,1
love free prime ship product back prime credit card,2
funni free ship actual mean still pay ship ive start shop elsewher price arent much differ standard store actual free ship,2
tri buy water bottl stock took screen say stock tri get spend dollar,1
app would adequ except longer see refus go nonblind dark mode,1
omg,1
slow expens,1
app l found cheap realli know,1
dark mode laggi better use onlin version,2
excel deliveri,2
im frequent user amazon app love accur time deliveri first time packag delay next day promis deliveri certain time spend requir amount told could cancel receiv refund cancel button complet remov order detail page guess ill wait see get deliveri today note happi,1
wors app ever alway bring item damag box look usag deliveri man must mean rude everi time cancel order reason last time use amazon,0
hear amazon think high standard realiti someth els deliveri servic drug dealer would better deal custom servic repres nice cours dont provid real work solut final app poor doesnt meet high standard come name like amazon disappoint,2
worst possibl custom servic deliveri driver price scam onlin retail offer qualiti product avail severali bottom price popular product rais sale scam user buy full price appear sale,0
fast shippingsaf ship etc,1
app lie tell get free shipo next hr got doesnt allow custom support help,2
lovw get anyth,1
want chang phone number,2
seri bad decis,0
bad beacou support bangladesh,0
one wealthiest compani world know make mobil app load quickli avoid crash,0
amazon terribl compani atroci custom support work condit cant access manual fix product,2
thing come fast never come late,1
أفضل تحديد مدى ساعات التوصيل بدقه حتى اتمكن من ادارة وقتى لبقيةاليوم,1
take long tp take money debit card,1
theyr fix technic issu reorder order pay day ship come time ye actual fix order place els pure spite help,0
conveni shop qualiti servic add prime amazon unbeat,2
accur fast,1
amazon egypt worst ever,0
amazon shop far good experienc problem item deliv,2
awesom love shop need,2
alway order friend want buy amazon payment tabbi saudi arabia sad say didnt order pleas put back payment tabbi,2
يا جماعة محدش يشتري من عندهم ب اي فيزة مشتريات عشان أنا اتنصب عليا في شاشة و جاتلي شاشة تاني غير الي طالبها و لبسوني مع البنك بعد ما عملت استبدال لمرة و جابلي نفس الشاشة و المرة التانية قالولي اعمل ارجاع و لما عملتها دفعت الفوائد بتاعة الفلوس عشان البنك رفض إلغاء العملية الا بسداد معجل,1
too⁵ mani ad,1
amazon use great late theyr ship account deliv state date subar usp better track record subscript go back ebay,2
love amazon app,2
ive custom amazon year chang card info new card label suspici want send info gave info ask wasnt enough cant even access account keep say account review kick,2
everi time click sponsor advertis app get page pop say wont load go back homepag what go correct c page error,0
driver follow deliveri instruct incid day packag move landlord offic thought stolen driver never contact cs gave promo credit despit multipl ticket creat,0
return go back credit card hidden bottom screen sever click find understand return product either whole food fedex drop ive person call custom servic see refund go form gift card scummi,2
one app bundl togeth notif one categori turn nonimport one overal slow everi page take age load reason even fast internet annoy navig,0
best bet,2
im alway order amazon,2
best everyth life,2
store broke peopl,0
batch support hispan,2
reason im give one star ai regu wish way perman dismiss instead temporarili doesnt alway swipe click one question box absolut annoy featur amazon,2
cant get app work,1
rufu rubbish pointless drivel also crash everi singl time tri open locker pixel,0
keep crash say amazon shop respond everi minut brows app someth,0
absolut fantast acquir thing career easili effect quickli,1
love amazon much like liter product find month,2
super easi shop buy experi,2
valu autonomi conveni might want consid sinc actual read review though care,2
amazon great place buy thing may struggl find pearwon realli like around holiday dosent show packag amazon echo show,2
use like amazon past year gone order delay almost time last one said problem ship damag ship undeliver wait day refund still want reorder tire lack servic anymor,0
aw custom servic provid answer never recommend compani tell everyon experi tri contact howev repeatedli send email account lock without detail pleas awar,0
total awesom,1
wonder price great varieti item choos good qualiti product,2
im mad cant use tablet anymor updat im still mad tablet pleas tablet app work phone cant turn refu make app compat tablet,0
custom servic nonexist us custom unless consid chat substandard ai custom servic one time long ago could actual speak human actual resolv problem cant countri saudi arabia exampl still phone number call wont help actual get human wonder vision futur custom care,2
love deliveri reason isnt star deliveri driver follow deliveri instruct sever packag stolen dont leav packag either locker mailroom last packag receiv liter left ground close day lobbi could get downstair retriev packag gone,2
p love one help sign,2
instabl lag su comment section see onlin other phone problem phone problem app,0
go place shop find anyth look,1
terribl ui frustrat menu realli worth use go store,2
site,1
cancel us tarrif,0
place share frustrat amazon prime worth regularli miss deliveri window day deliveri joke honestli readi cancel membership,2
watch deliveri driver deliv parcel neighbor mine say deliveri watch app say cant deliv due weather pretti scumi,1
overal good access order still glitch wont load place mani order mayb stop,2
incred conveni,1
love worth great save,2
first order made didnt get part want second tri go app assess item bought problem end doesnt let access page pleas fix,0
good long read review homework,2
worst custom servic ive ever receiv recommend buy anyth compani your better temu wish amazon ive tri get refund product didnt receiv even bought two polic report show amazon didnt receiv packag deni refund without merit ive tri ti get refund month keep give run around terribl servic,2
app amazon prime membership price increas much im older manag incom isnt much deal anymor also often order late get lax put custom last,2
good luck get help problem receiv wrong product report wasnt order send back right one resent told id charg nd time send back item didnt receiv first place call sort told taken care charg anyway way talk us base custom support actual resolv either ai guy india ridicul,2
keep search top recent updat keep give error buy item stock tri order twice app great sponsor item ridicul understand pay slot result would great add search list individu pleas thank,2
still dark mode hate use app dark environ night get flash soon open,0
amazon deal arent realli anymor conveni,2
amazon custom servic team disrespect inconsider first item book took two week deliv despit prime membership advis deliveri time two day receiv book look run industri vacuum cleaner compani attempt deliv item outsid busi hour explain would work monday would cost pick packag custom servic offer,0
star downsid prompt buy recv purchas day often nothogwash old star respons question app end take g phone simpli use way much uninstal reinstal see result review result year mb never recvd respons contact form,1
great shop line,2
thi call said thi lost order kept money im refund cuz amazon want rob differ gmail account order rob call gave ship order still cant find order give money back dont buy anyth els,0
sluggish full bug hard believ still lack dark mode,0
iam prime membershipbut oneday two day deliveri day item deliveredso servic satisfi,1
app would absolut perfect could control subscript app,2
taken month your tell order deliv februari dont think ill order anyth take long get order,2
refus return order year amazon still doesnt return order everi citi saudi arabia know deliv order citi benefit return nah dont shein deliv return order citi learn huge blunder amazon part recommend,2
سيئ مقارنة في نون,1
support dei,2
good servic q,2
love shop amazon find pretti much anyth look compar price option prime account liter save last coupl year alway look amazon first,2
نصابة وخدمة عملاء سيئة,1
dark mode pleas add option,1
amazon ai wast time never help dumb stupid take min say need human time app wipe order histori chang gift card balanc shop year friend send gift card help cloth cheap thin wear fast like giant tiger got good axe solar box hydro ecoflow box amaz forwhat need power amazon say never place order month return,2
bar code scanner work,1
use abl save thru amazon everyth nation rise sky high price wise hard tell differ kind save im get app,2
default ship locker thing day age resid take packag chang everi singl damn time,0
fun,2
alway lot choic er love,2
lyer think stupi bad deliveri ppl complain time noth chang keep say sorri soon close accout chang away,0
amazon ship stuff slow deliveri driver dont stop deliv packag leav dont even check see home call fact left wont wait go outsid pick though take abort packag king hous deliv took never deliv,2
last day amazon,2
fazoool app hai account creat krne mai e itni problem arhi hain agi kyaa bane ga fail hai ye app,0
easi use reason price,1
amazon love amazon alway prompt,2
filter option made usa would great lot product countri low qualiti plain useless app isnt bad mani issu,2
problem find need complet purchas use amazon app,0
find anyth esp good price,2
app great part rufu hand go everi time seafor differ product cant see anyth rufu decid help,2
st time order far good,2
app reflect uneth side amazon allow seller swap product cheaper version use review better product,2
amazon australia worst show month deliveri time better order shein temu get item within day,0
easi use sure also consum copiou amount data order shovel video ad search result,2
go downhil fast might well ignor deliveri estim cuz theyr worthless rd parti shippingno stuff sold ship amazon failur consist ur busi model stay busi lazi simpl answer well im choos lazi anymor shop local adapt minimalist lifestyl invit human be world u lazi boycott amazon today,2
amazon overal amaz onlin place shop get thing right condit maker tri keep top qualityplu chanc win free gift card alway best,2
app stole dollar order packag went said need pay alreadi took dollar time still didnt go owe bank dollar im never order,0
download cancel prime membership didnt want set convolut stupid there way cancel matter mani tutori follow cancel button simpli,0
ابلكيشن بشع وسيئ والمنتجات بتيجي مش زي الي اتطلبت و بتيجي مقطوعه ده غير لما تعملو طلب استرجاع بيدوخوكو على الفلوس حرفيا بجد تجربة سيئة نون احسن بمراحل,1
amazon place shop like anyth order pieceluggag set got coupon free ship order everyth price done next day go see order like would come saw price never got order realli surpris never happen app use think amazon littl glitch someth would realli recommend fix,2
goodby amazon,2
horribl servic app say packag deliv cant locat packag use usp claim left parcel locker check locker noth insid custom servic could help anyth wait refund time wast never order amazon,2
love amazon prime great,2
order screen stuck keep load screen doesnt changestuck blank mode,0
love easi conveni shop amazon deliveri choic realli catch attent,2
app refus connect amazon locker make imposs get help real person,2
still send spam market notif turn without lose deliveri notif gross,0
ive coupl deliveri poorli packag product insid ruin small percentag order custom servic incred coupl suggest pleas add abil show search result price per ouncecountetc almost everi item list inaccuraci list graphicsdesc price per itemoz want give money hard press purchas button cant repli info,0
happi problem fix glad money back item receiv custom servic amaz total recommend amazon everyth need world today,2
satisfi usual,1
total stupid dont notif categori,0
track phone locat,1
app put wrong address packag dont get em dont care,0
yo pedí un lápiz para el tabl nunca llegó es estafa que,1
help find thing way quickli,2
love amazon wish theyd take money place order instead wait item ship,2
dont know anyth correctli,1
find need,1
simpl easi fi want order fast servic well done,2
fantast interfac easi use definit conveni,1
wife love amazon live countri conveni us,2
sinc jan month amazon turn packag usp finish deliveri one actual got deliv other got mark undeliver return sender one item space heater took day arriv temp make wait day could cancel order reorder continu ill go back shop oldfashion way im realli happi amazon ship day,0
idea chang constant notif may find interest buy suck soon one swipe away anoth one appear singl male need constant remind women cloth fashion jewelri besidesm way segment notif anymor cant get deliveri notif either noth cant control ill notif,2
promis deliv,1
love app good,2
use year everi order contact custom servic time becuas system error poorli design gift card system hallf custom servic agent impolit everi time made mistak dont admit never compens sort third driver also bad hear peopl also say grow bigger bigger qualiti go wors snd wors,0
get get get perfect buy anyth want even hous dont beliv check,2
ship fee dont make sens sometim,1
أسوء برنامج,1
everyth go expect last order hope one also,2
wonder busi alway pleasur shop,1
deliveri excel thank bought last night deliv morn,2
great servic quick arriv time love,2
great need someth cant make store thing order usual arriv within day week,2
great cant live wont let pay order wait sever day week process payment,2
prime member year amazon driver ran mail box didnt report suppli video evid incid receiv neighbor still refus fulli pay repair new mailbox instal extrem disappoint principl shop elsewher scari part deliv neighborhood could stuck pay anoth repair driver zero star,0
thing deliv time troubl deliveri come happen,1
alway larg select im look,1
best onlin shop app ever,2
amazon good tablet,2
terribl search someth get mostli unrel product search function wast time go back ebay,1
amazon lost busi boycot anyth yall want fix compani,0
absolut shock order item pay prime told next day deliveri normal ok case told delay next day order someth yesterday turn problem absolut shock servic mention pay monthli subscript watch ad cancel prime,0
owsom,1
latest updat way access amazonsmil indic updat info,1
conveni cant overlook,1
app work fine amazon never deliv time even pay faster ship thing get delay coupl day month,0
bring forward yearli review app point better go store get product normal price one that nearli doubl start price,2
amazon first place go,2
love prime fast receiv item,2
cancel subscript dont want subscript,0
amazon everyth need make conveni,2
fraudul custom servic agent said place order refund ship fee place order said initi refund sever day follow agent talk said there refund cant refund even though sent screenshot previou convers agent scam servic poor incompet custom servic agent,0
found app track user without consent ill use browser app,2
enjoy would like product review,2
amazon haul work app use googl pixel tab highli compat app regularli updat go figur amazon app doesnt work,2
horribl experi custom servic order,1
order item use prime two day deliveri date deliveri say item expect five day look item im order new one still say two day ship facil near point prime deliveri date truth deliveri date show delay new purchas would issu fact system lie say new order would faster origin,1
use app send mother live thousand mile away thing need elderli doesnt drive cant say enough wonder amazon amazon fresh deliveri super fast write door except one time somebodi decid leav larg order lobbi requir get help get upstair apart,2
use year easi search past present purchas,1
refus replac refund spoil food deliveri essenti stole money wont provid support thank amazon,0
love amazon shop mani reason,2
first review ive ever done custom servic absolut except never problem order return thing app,2
buy anywher els unless like give away hardearn money,2
probabl favorit shop app bad experi year amazon,0
rufu sux new ai assist call rufu irrit im tri search useless inform provid swipe minimis everi bloodi time search app let turn silli featur,0
union,1
easi use excel applic,2
except qualiti work great sever joint inflamm arthriti extrem satisfi continu enjoy use product,2
dont like amazon doesnt deliv address,0
excel app thank,2
stole hundr deliveri,1
would give star bad app dont recommend,0
good except took away back door deliveri option peopl dont like packag sit front porch due theft back door option good reason dont offer option,2
deliv yet mean almost minut alway readi,1
wouldnt let creat account due unusu activ liter instal app,1
noth cant get,1
trash app push bare work product ripoff real thing,1
surprisingli easi use,1
updat amazon continu disappoint lie unbeliev especi expect arriv seem never ever next day order way time say smfh wow thought amazon would someth awesom yet year aw aw costli snake liar cost marriag familyand thiev trust amazon,2
worst ever,0
day ship longer exist prime isnt worth money also increas price good prime member bozo crook tri shop local,2
pleas implement dark mode,1
paid day deliveri multipl time havent gotten prime paid get day talk support said would still come day would credit dollar neither thing happen lie dont job real illeg tell cant even get refund item receiv ive told get escal next support talk say record,2
terribl cant load,1
love shop amazon find everyth anyth good price,2
would nice talk actual agent item bot ask thing,2
would nice app werent ad suggest annoy distract mention absolut noth would want miss old basic amazon prime definit scale back order time turn backward,2
think amazon amaz amaz place order anyth want world low budget price,1
im sure major amazon profit go bezo pocket aw app compar ebay app terribl could search hammer get thrown sponsor list screwdriv collect email dont link app need clunk way select option get pick section help section infuri take unhelp circl ebay collect locker id simpli delet amazon app,2
need better custom servic rep smarter deliveri person order son formula day old driver took back couldnt get build even though front desk would let,2
app fine car place order cant seem get right mani wrong item cant get around return alway loss,0
awesom alway,1
rd parti seller histori scam buyersdidnt honor full refund includ return ship situat item qualifi az guarante amazon deni refund despit twice csr guarante refund spend month amazon spent account busi person cancel shock amazon platform scammer valu guarante return everyth cheaper elsewher,0
horribl made order went show recent order cant track anyth,1
never deliv right address,1
gooo app,1
track everyth uninstal,1
uselessi item deliv collect didnt send pick code even sort issu get custom servic automat messag actual person talk help,2
would gladli give star there one enorm issu current amazon alert work also idea deliveri way late act fix would rate,2
order deliv fast product good easi way shop,2
help recov account broke phone get new phone number call support differ time got hung separ time tell delet whole account pay month audibl month prime month amazon music cant even log support help messag support without account account recoveri without log,2
account hack twice zero support favor robot humankind amazon protect us clear seller mani fake account bot book sell fake fals inform im end use ok,2
fake review get stay legitim review remov break commun guidelin guidelin say bad product bad what point review oh right sell store advertis illeg,0
pushnachrichten mit werbung,1
great way,2
quick deliveri,1
much good sale,2
app keep tell password incorrect,1
order dont get hous,1
extrem difficult brows product find anyth sponsor comment review often paid custom servic aw agress phone care chat week issu refund rememb time year amz good onlin store werent flood sponsor chines product custom servic actual servic good one,2
use good got ta wait week deliv amazon locker wouldnt problem could expedit deliveri pay extra cant even pay extra deliv faster,2
ok got need time found need stuff,2
use buy lot noth avail countri address,1
tri order tablet couldnt process order fix everyth bank told wait hr good wasnt tri reach back never avail today cancel order screw deal tablet think im gon na pay full price im delet app cancel prime,2
favorit shop app use everyth help countless time pinch transport,2
custom servic horribl,1
first time shop site love far,2
busco el gp puedo,1
access music subscript,1
late packag use item shipment frequent arriv late recours tri complain auto repli give gener uncar respons ive packag look open use alreadi buy cloth expect come origin unopen packag look like someon use threw item back bag custom servic resend someon els like big deal start feel like ali,2
sick function issu go long app best way navig site constant issu app made angri see dog everi time page fail load genuin hate unnecessarili frustrat associ dog that sincer unfair app go function poorli least get pick choos imag forc see,0
unabl receiv order time driver attempt deliv packag address custom servic fix issu happen worth pay prime rural area,2
pleas revert vertic layout upcom deliveri section rememb custom alway right realli realli realli need dark mode app especi ole devic excus dark mode,1
tbh long use use amazon late egypt becom bad experi leak inform seller allow pretend amazon give bad experi item differ order complain didnt help fraud scam,0
place order take money time ask new payment type dont enough fund account took money cancel order dose give money got doller item doller tax get doller item doller item need new payment method like didnt take money alreadi left account dollar,2
autoinstal devic without consent,0
bc cant get book amazon app kindl,0
love amazon best place home shop,2
love dont like dont get check order map right away also android dont like differ devic search bar delet search type android liter keep person delet draft type also hate dont say item ship deliveri packag stop away right away annoy basic useless bc,0
great app love amazon,2
hate amazon charg membership year half alreadi cancel subscript cant deliv packag right apart make close imposs speak human repres get miss packag disput charg recommend close account chang card inform never buy anyth,0
app optim properli stutteri bad scroll,0
use app day post magiclli gone reinstal everi time tri open send back home page tip whould help dearli edit mom parent control one app couldnt use app star edit still broken star,0
cancel sub pay like featur dont work im get ad app ad even though pay take packag extra day get half show movi like suddenli gone what point app anymor,2
